Nom,Categorie,Description,Prix,Ref,Stock,Image
"Audi RS3 SPORTBACK",0,"Compacte sportive haute performance",560,L01,1,RS3.jpeg
"Porsche 911 Turbo",0,"Voiture de sport emblématique offrant maniabilité et vitesse exceptionnelles",670,L06,2,911.jpeg
"Mercedes AMG GT",0,"Coupé sportif luxueux et puissant",450,L07,1,AMGGT.jpeg
"BMW M5",0,"Combinaison de performance et de confort dans une berline haut de gamme",780,L08,1,M5.jpeg
"Lamborghini Huracan",0,"Supercar aux performances époustouflantes et au design audacieux",890,L09,2,Huracan.jpeg
"Ferrari 488 Spider",0,"Cabriolet sportif avec une puissance exceptionnelle et un style distinctif",850,L10,1,Spider.jpeg